[
  {
    "id": "health",
    "sourceStat": "health",
    "initialValue": "full",
    "onEmpty": [
      {
        "kind": "reset-state",
        "locationId": "starting-location",
        "incrementFlagId": "death-count",
        "preserve": {
          "inventoryIds": ["moonvine-cutting"],
          "skillXp": true,
          "discoveredLocations": true
        }
      },
      { "kind": "chat", "messageKey": "resource.health.empty" }
    ]
  }
]
